{
  "schemaVersion": "1.0.0",
  "bundleId": "character-mi",
  "preloadPolicy": "eager",
  "assets": [
    { "assetId": "character_mi_concept-sheet_v01", "path": "design/characters/character_mi_concept-sheet_v01.svg", "type": "svg", "language": "none", "license": "MI-Academy-Owned", "preloadPriority": "low", "reviewStatus": "draft", "accessibility": { "labelKey": "mi.conceptSheet" }, "notes": "Documentation-only concept exploration sheet, not runtime-bundled by any package." },
    { "assetId": "icon_mi_head_v01", "path": "packages/design_system/assets/characters/mi/icon_mi_head_v01.svg", "type": "svg", "language": "none", "license": "MI-Academy-Owned", "preloadPriority": "critical", "reviewStatus": "draft", "accessibility": { "labelKey": "mi.name" } },
    { "assetId": "character_mi_face_neutral_v01", "path": "packages/design_system/assets/characters/mi/character_mi_face_neutral_v01.svg", "type": "svg", "language": "none", "license": "MI-Academy-Owned", "preloadPriority": "critical", "reviewStatus": "draft", "accessibility": { "labelKey": "mi.expression.neutral", "reducedMotionFallback": "character_mi_face_neutral_v01" } },
    { "assetId": "character_mi_face_welcome_v01", "path": "packages/design_system/assets/characters/mi/character_mi_face_welcome_v01.svg", "type": "svg", "language": "none", "license": "MI-Academy-Owned", "preloadPriority": "critical", "reviewStatus": "draft", "accessibility": { "labelKey": "mi.expression.welcome", "reducedMotionFallback": "character_mi_face_welcome_v01" } },
    { "assetId": "character_mi_face_thinking_v01", "path": "packages/design_system/assets/characters/mi/character_mi_face_thinking_v01.svg", "type": "svg", "language": "none", "license": "MI-Academy-Owned", "preloadPriority": "high", "reviewStatus": "draft", "accessibility": { "labelKey": "mi.expression.thinking", "reducedMotionFallback": "character_mi_face_thinking_v01" } },
    { "assetId": "character_mi_face_hinting_v01", "path": "packages/design_system/assets/characters/mi/character_mi_face_hinting_v01.svg", "type": "svg", "language": "none", "license": "MI-Academy-Owned", "preloadPriority": "high", "reviewStatus": "draft", "accessibility": { "labelKey": "mi.expression.hinting", "reducedMotionFallback": "character_mi_face_hinting_v01" } },
    { "assetId": "character_mi_face_happy_v01", "path": "packages/design_system/assets/characters/mi/character_mi_face_happy_v01.svg", "type": "svg", "language": "none", "license": "MI-Academy-Owned", "preloadPriority": "critical", "reviewStatus": "draft", "accessibility": { "labelKey": "mi.expression.happy", "reducedMotionFallback": "character_mi_face_happy_v01" } },
    { "assetId": "character_mi_face_celebrating_v01", "path": "packages/design_system/assets/characters/mi/character_mi_face_celebrating_v01.svg", "type": "svg", "language": "none", "license": "MI-Academy-Owned", "preloadPriority": "high", "reviewStatus": "draft", "accessibility": { "labelKey": "mi.expression.celebrating", "reducedMotionFallback": "character_mi_face_celebrating_v01" } },
    { "assetId": "character_mi_face_encouraging_v01", "path": "packages/design_system/assets/characters/mi/character_mi_face_encouraging_v01.svg", "type": "svg", "language": "none", "license": "MI-Academy-Owned", "preloadPriority": "normal", "reviewStatus": "draft", "accessibility": { "labelKey": "mi.expression.encouraging", "reducedMotionFallback": "character_mi_face_encouraging_v01" } },
    { "assetId": "character_mi_face_surprised_v01", "path": "packages/design_system/assets/characters/mi/character_mi_face_surprised_v01.svg", "type": "svg", "language": "none", "license": "MI-Academy-Owned", "preloadPriority": "normal", "reviewStatus": "draft", "accessibility": { "labelKey": "mi.expression.surprised", "reducedMotionFallback": "character_mi_face_surprised_v01" } },
    { "assetId": "character_mi_face_listening_v01", "path": "packages/design_system/assets/characters/mi/character_mi_face_listening_v01.svg", "type": "svg", "language": "none", "license": "MI-Academy-Owned", "preloadPriority": "normal", "reviewStatus": "draft", "accessibility": { "labelKey": "mi.expression.listening", "reducedMotionFallback": "character_mi_face_listening_v01" } },
    { "assetId": "character_mi_face_idle-sleep_v01", "path": "packages/design_system/assets/characters/mi/character_mi_face_idle-sleep_v01.svg", "type": "svg", "language": "none", "license": "MI-Academy-Owned", "preloadPriority": "low", "reviewStatus": "draft", "accessibility": { "labelKey": "mi.expression.idleSleep", "reducedMotionFallback": "character_mi_face_idle-sleep_v01" } },
    { "assetId": "character_mi_face_error-recovery_v01", "path": "packages/design_system/assets/characters/mi/character_mi_face_error-recovery_v01.svg", "type": "svg", "language": "none", "license": "MI-Academy-Owned", "preloadPriority": "critical", "reviewStatus": "draft", "accessibility": { "labelKey": "mi.expression.errorRecovery", "reducedMotionFallback": "character_mi_face_error-recovery_v01" } },
    { "assetId": "character_mi_face_goodbye_v01", "path": "packages/design_system/assets/characters/mi/character_mi_face_goodbye_v01.svg", "type": "svg", "language": "none", "license": "MI-Academy-Owned", "preloadPriority": "normal", "reviewStatus": "draft", "accessibility": { "labelKey": "mi.expression.goodbye", "reducedMotionFallback": "character_mi_face_goodbye_v01" } },
    { "assetId": "character_mi_pose_wave_v01", "path": "packages/design_system/assets/characters/mi/character_mi_pose_wave_v01.svg", "type": "svg", "language": "none", "license": "MI-Academy-Owned", "preloadPriority": "normal", "reviewStatus": "draft", "accessibility": { "labelKey": "mi.pose.wave", "reducedMotionFallback": "character_mi_pose_wave_v01" } },
    { "assetId": "character_mi_pose_point-right_v01", "path": "packages/design_system/assets/characters/mi/character_mi_pose_point-right_v01.svg", "type": "svg", "language": "none", "license": "MI-Academy-Owned", "preloadPriority": "normal", "reviewStatus": "draft", "accessibility": { "labelKey": "mi.pose.pointRight", "reducedMotionFallback": "character_mi_pose_point-right_v01" } }
  ]
}
